{
  "pluginKey": "customer-callresult-db-sync",
  "displayName": "Customer Call Result DB Sync",
  "version": "1.3.0",
  "vendor": "Acme Sp. z o.o.",
  "vendorContact": "support@acme.example",
  "sdkVersion": "1.x",
  "entryPointClass": "com.acme.contactcenter.plugin.callresultdbsync.CustomerCallResultDbSyncPlugin",
  "extensionPoints": [
    "POST_CONTACT_END",
    "DISPOSITION_SET"
  ],
  "permissions": [
    "contact:read",
    "db:egress:crm-demo-db:5432"
  ],
  "checksumSha256": "773fae67e8cc62b45c7e2f8d4c0cae62d28fa68127687350a4b969db72f3a334"
}
