{
  "pluginKey": "crm-url-launcher",
  "displayName": "CRM URL Launcher",
  "version": "1.1.0",
  "vendor": "Acme Sp. z o.o.",
  "vendorContact": "support@acme.example",
  "sdkVersion": "1.x",
  "entryPointClass": "com.acme.contactcenter.plugin.crmurlauncher.CrmUrlLauncherPlugin",
  "extensionPoints": ["PRE_CONTACT_CONNECT", "MANUAL_ACTION"],
  "permissions": ["customer:read", "contact:read"],
  "uiPanels": [
    {
      "panelId": "crm-url-panel",
      "mountPoint": "AGENT_DESKTOP_SIDE_PANEL",
      "url": "classpath:/plugin-ui/index.html",
      "sandbox": "allow-scripts allow-forms"
    }
  ],
  "checksumSha256": "f5cbf1cc2744e999d3c44a78fc511c301f796541df2ef5ce02fdb502d34d17ec"
}
